,body,comments_this_post,created_utc,current_time,post_title,ups
192,"I was home schooled as a kid, starting at about 12 or 13, and my dad gave me the choice of joining a football extracurricular thing or learning ballet. I chose ballet for this exact reasoning.",9,1527614771.0,1527949589.9901388,The only way to hold hands with a girl,18
193,"I was home schooled as a kid, starting at about 12 or 13, and my dad gave me the choice of joining a football extracurricular thing or learning ballet. I chose ballet for this exact reasoning.",0,1527614771.0,1527949593.618453,zach makes a funny,18
194,r/PandR,5,1527645875.0,1527949597.370899,Calzone,5
195,"Why does he say she looks pretty first

Edit: just reread that and realized it says petty",28,1527603933.0,1527949601.2579799,She's skilled as fuck,301
196,"If we threw out all the books that make people uncomfortable, most of high school English class would be gone.",515,1527555725.0,1527949605.666056,I’m guessing they haven’t read the book...,3113
197,"If we threw out all the books that make people uncomfortable, most of high school English class would be gone.",0,1527555725.0,1527949609.343036,It really is like that,3113
198,"Wow, wife is intolerant ",1,1527639610.0,1527949612.95816,Introducing girlfriend to family,8
199,Damn right! I think I wish I could do that... then again maybe not... the practice would be hell!,9,1527610848.0,1527949616.6287858,Trick shots in the restroom,8
200,"Jokes aside, could you legally get pulled over for this?",41,1527574775.0,1527949620.577064,Cops suck,18
201,That shouldn't be a problem unless you are watching the videos on chrome and have 2gb of ram,2,1527625440.0,1527949624.1643252,Just your everyday first world problem,2
202,r/2healthbars ,36,1527568745.0,1527949628.256629,🧐,165
203,"That ""all liberal"" part rubs me the wrong way. Aside from her apolog-lies.",10,1527653112.0,1527949631.94784,Roseanne apologizes,39
204,"True, but too many will kill you. ",2,1527606410.0,1527949635.51927,Birthdays,9
205,"As opposed to what, though? In 10 years of work, I've only ever worked in an office or done manual labour or hospitality.",2,1527622154.0,1527949639.150126,Don’t forget coffee,3
206,Still not as good as reddit karma,1,1527651036.0,1527949642.687786,Credit Karma,3
207,r/cringepics? Unless it’s a joke...,3,1527627707.0,1527949646.255119,Youtuber gets recognized,4
208,girls are weird,8,1527607619.0,1527949650.32696,nothing to wear,12
209,My gynaecologist gave me a sheet today... They updated their privacy policy. I can't escape,2,1527603574.0,1527949653.974477,Jesus Christ Ouija,17
210,"I dated a girl for 2 years that kept calling me by her dog's name whenever she got upset. Sometimes she'd call the dog by my name, which somehow made it worse.",349,1527528091.0,1527949659.009529,Poor Nigel,2960
211,"Maybe I'm dense, but I don't get the joke. Is it that he is mistranslating something? I'm just trying to figure out if this is a clever joke that I am not getting or if I am reading too much into it.",8,1527685605.0,1527949662.662687,Beautiful.,2
212,Deep down u can see the pain in his eyes,51,1527546201.0,1527949666.432419,haha please come back,349
213,Who else rolled their eyes up real quick to see if they could see their forehead?,1,1527682133.0,1527949670.10465,Nbd,2
214,I am trying to imagine myself doing it without wetting my entire body.,3,1527619183.0,1527949673.797887,I think we all wish we had this skill,1
215,"For the record, I called her a bitch and she called me pig shit. If you look hard enough, you could probably find it. I didn’t delete them 🙂",3,1527621642.0,1527949677.583235,She blocked me 5 years ago. Does this mean I win?,14
216,"I believe that is the proper way to arrive in Australia, having fucked off to there.",9,1527580890.0,1527949681.25431,Future plans,27
217,Just a really weak patient ,17,1527574967.0,1527949685.126994,Cool nurse?,32
218,"You said ""drum roll"" not ""drum solo"" ... I'd fire you for thinking one is the other. ",8,1527598371.0,1527949688.9625669,*Drum Roll*,6
219,I'm going to go in a different direction then other commenters and say this brought me back to some really happy childhood memories. ,34,1527561118.0,1527949692.75119,Take me there,102
220,Shame he caught crabs before eating one. If you know what I mean. ,4,1527579215.0,1527949696.53404,Shipwrecked Diary,17
221,r/comedyhomicide,6,1527632941.0,1527949700.149577,🤨,8
222,Read this as John Madden ,1,1527621386.0,1527949703.774843,Girl Math,1
223,"Have you ever heard of our Lord and Saviour, General Obi-Ewan McKenobi?",8,1527586315.0,1527949707.478838,You need jesus,11
224,"^(Hi, I'm a bot for linking direct images of albums with only 1 image)

**https://i.imgur.com/MwaZpMT.png**

^^[Source](https://github.com/AUTplayed/imguralbumbot) ^^| ^^[Why?](https://github.com/AUTplayed/imguralbumbot/blob/master/README.md) ^^| ^^[Creator](https://np.reddit.com/user/AUTplayed/) ^^| ^^[ignoreme](https://np.reddit.com/message/compose/?to=imguralbumbot&amp;subject=ignoreme&amp;message=ignoreme) ^^| ^^[deletthis](https://np.reddit.com/message/compose/?to=imguralbumbot&amp;subject=delet%20this&amp;message=delet%20this%20dzrvsye) ",2,1527614892.0,1527949711.12473,It’s a real struggle,1
225,"I saw a guy in traffic court try to get out of a ticket by arguing everyone was speeding and the cop, who was two cars behind him, had no reason to single him out.  The cop confirmed that indeed there were a lot of people speeding. The judge asked him why he singled out the driver to be stopped. The cop said he didn’t. The cop explained that he turned on his lights and siren and the driver was the first person to pull over to the side of the road.  Bit of a laugh and the judge reduced the penalty in honor of the driver’s honesty to pull over.",1618,1527513102.0,1527949716.200489,Gotta catch em all,7672
226,The evils of peer pressure,10,1527537151.0,1527949720.203997,The hard naked truth about celebrities,41
227,The evils of peer pressure,0,1527537151.0,1527949723.796808,Roomba Wars,41
228,[deleted],1,1527577748.0,1527949727.771453,Silent mode,-4
229,Absolute Unit this Lad,33,1527541747.0,1527949731.7235572,The buffest cat on the block,54
230,"Google says potential urban legend turned psuedo-fact. No military records can confirm, most say an Italian joined them and followed them home like a puppy, except he was a full-grown man.",5,1527569436.0,1527949735.485048,wait what,19
231,Motherlode ,4,1527576426.0,1527949739.123322,Motherload,8
232,I think we can still rebuild it if there's a foundation! Ah wait.. Sorry bout that. Its gone.,2,1527604354.0,1527949742.776007,Let’s organize a revolution!,5
233,Snitch...,12,1527529028.0,1527949746.6751091,Nobody lies to Susan,76
234,"When I said that I wanted to have kids, and you said you wanted me to have a vasectomy, what did I do? And then, when you said that you might want to have kids, and I wasn't so sure, who had the vasectomy reversed? And then when you said you definitely didn't want to have kids? Who had it reversed back? Snip, snap! Snip, snap! Snip, snap! I did! You have no *idea* the physical toll that three vasectomies have on a person!",3,1527531616.0,1527949750.428671,Kids,23
235,Is that a real tweet? The “nice!” at the end is electric,12,1527561375.0,1527949754.338308,They would be so proud,31
236,"I wouldn't look into too much because that's honestly something I'd do. 

Y'know if I had friends to call on the spot",7,1527546213.0,1527949758.23997,Quick thinking,51
237,"Oh good, another spoiled, entitled 16 yr old kid that's never had to work a day in their life, doesn't know the value of a dollar, and will judge or look down their nose at anyone that doesn't have a car as nice as theirs.",6,1527567760.0,1527949761.9034932,"A new Camaro isn't the perks of being 16, it's the perks of being rich",9
238,Or a two step confirmation process 8-12 hours later! ,9,1527543479.0,1527949766.0725179,Happens Way Too Often,8
239,"We don’t talk about that.......,..,.thing",2,1527651594.0,1527949769.826323,Welcome to America,1
240,"We don’t talk about that.......,..,.thing",0,1527651594.0,1527949773.487296,See Yaa,1
241,This guy has had an awful lot of great white tweets lately.,4,1527540319.0,1527949777.0417511,*Puts on sunglasses*,12
242,"Yes. Especially when my mom does it. I’m not gonna kill you, chill",4,1527527236.0,1527949780.538039,You’ll be ok dramatic bitch,18
243,Hahaha This Genie is woke as fuck. ,11,1527537313.0,1527949784.288552,BPT didn’t like my post 😕,10
244,“Wow.”,13,1527519298.0,1527949787.9889479,You fucking idiot,25
245,"Dogs cost a lot of money when cared for properly. Food, health, etc.",7,1527533309.0,1527949791.699342,All my dogs are rescue dogs,13
246,"Master, teach me how you don't cry ""real"" tears",1,1527562522.0,1527949795.3962991,It was a crushing defeat ..,-1
247,I WOKE IT UP SEVEN,2,1527566195.0,1527949799.168395,Sexual orientation,2
248,"She could save others from sexism, but not herself.",7,1527537404.0,1527949803.200605,Ironic,10
249,There is no Dana only juul.,7,1527574091.0,1527949806.955344,Unrealistic tv high schools,11
